{
  "decisionId": "0f9c7e5a-0000-4000-8000-00000000d003",
  "reservationId": "5b0a6f0e-7c0d-4a0e-9a64-0c2e7f1b9a11",
  "status": "NEED_APPROVAL",
  "deposit": null,
  "strategyName": "DefaultDecisionStrategy",
  "strategyVersion": "2.1.0",
  "executionType": "AUTOMATED",
  "fallbackUsed": false,
  "reasonCode": "HIGH_VALUE_REVIEW",
  "reasons": ["Đơn có giá trị cao, cần Manager xem xét mức cọc."],
  "recommendations": [
    { "type": "REQUIRE_APPROVAL", "description": "Manager duyệt kèm mức cọc." },
    { "type": "ALTERNATIVE_SLOT", "description": "Có thể dời sang khung giờ liền kề." }
  ],
  "approvalExpiresAt": "2026-11-18T14:15:00+07:00",
  "evaluatedAt": "2026-11-18T02:15:00.041Z"
}
